{
  "schema_version": "1.0",
  "contract_version": "v1",
  "adapter_id": "venue-adapter-equities-br-v1",
  "asset_class": "equities_br",
  "venue_type": "broker_adapter",
  "execution_path": "execution_gateway_only",
  "allowlist_group": "trading_phase2_brokers",
  "supported_order_types": ["market", "limit", "stop", "stop_limit"],
  "shadow_mode_required": true,
  "decision_r3_required_for_live": true,
  "status": "blocked"
}
